<?xml version="1.0" encoding="iso-8859-1"?>
<!DOCTYPE form SYSTEM "..\..\docs\dtd\php2go_forms.dtd">
<form>

	<section name="Wine" id="addwineca" required_flag="T" required_color="#FF0000" required_char="*">
	
        <hiddenfield name="pageid" value="25"/>

        <hiddenfield name="editMode"/>
        <hiddenfield name="wineid"/>
        <hiddenfield name="wine_delivery_date_id"/>
        <hiddenfield name="estate_id"/>
        <hiddenfield name="delivery_total" value="0"/>
        <hiddenfield name="total_bottles" value="0"/>
        <hiddenfield name="price_per_unit" />
        <hiddenfield name="price_winery" />
        <hiddenfield name="is_international" value="0" />        

        <editfield name="wine_name" label="Wine name"  tabindex="1" size="47" length="225" required="T"/>

        <lookupfield name="lkup_bottle_size_id" label="Size"  tabindex="2" default="1" nofirst="T" multiple="F" size="1" width="78" >
            <datasource>
                <keyfield>lkup_bottle_size_id</keyfield>
                        <displayfield>caption</displayfield>
                        <orderby>lkup_bottle_size_id</orderby>
                <lookuptable>lkup_bottle_sizes</lookuptable>
            </datasource>
        </lookupfield>

        <lookupfield name="lkup_wine_color_type_id" label="Type"  tabindex="2" default="1" nofirst="T" multiple="F" size="1" width="82" >
            <datasource>
                <keyfield>lkup_wine_color_type_id</keyfield>
                        <displayfield>caption</displayfield>
                        <orderby>lkup_wine_color_type_id</orderby>
                <lookuptable>lkup_wine_color_types</lookuptable>
            </datasource>
        </lookupfield>
        <editfield name="cspc_code" label="CSPC code" tabindex="3" size="22" length="25" required="T"/>
        <editfield name="vintage" label="Vintage"     tabindex="4" size="22" length="4" minlength="4" required="T" mask="INTEGER"/>

        <editfield name="price" label="Display price" tabindex="5" size="12" length="12" required="T" >
            <listener type="JS" event="onblur" action="setPrice(this,0)"/>
             <listener type="JS" event="onKeyPress" action="return chkFLOAT(this, event);"/>
        </editfield>

		 <editfield name="wholesale" label="CSWS price" tabindex="6" size="14" length="12"  required="T">
            <listener type="JS" event="onblur" action="setPrice(this,1)"/>
            <listener type="JS" event="onKeyPress" action="return chkFLOAT(this, event);"/>
        </editfield>

        <editfield name="delivery_date" label="Delivery date" mask="DATE"  default="go_TODAY" size="12" length="10" required="T" tabindex="7" />

        <editfield name="total_cases" label="Total cases"   tabindex="7" size="25" length="8" required="T" mask="INTEGER">
            <listener type="JS" event="onblur" action="getBottles(this.value)"/>
        </editfield>

        <editfield name="bottles_per_case" label="Bottles / case" tabindex="8" size="22" length="3" required="T"  mask="INTEGER">
            <listener type="JS" event="onblur" action="getBottles(this.value)"/>
        </editfield>

        <editfield name="show_total_bottles" label="Total bottles" tabindex="9" size="22" length="12" readonly="T" default=""/>

        <buttons>
      	  <button name="btnAdd" type="BUTTON"  value="OK  " />
        	  <button name="btnCancel" type="BUTTON" value="Cancel" />
        </buttons>

	</section>

</form>

