<?xml version="1.0" encoding="iso-8859-1"?>
<!-- Form60 : template used in AddUser.php -->
<!DOCTYPE form SYSTEM "..\..\docs\dtd\php2go_forms.dtd">
<form  >


	<section name="My Section" id="commLevels" required_flag="T" required_color="#FF0000" required_char="*">
        <!-- row1 estate name, number, delivery date-->

		<hiddenfield name="pageid" value="39"/>
		<hiddenfield name = "levels"  value = "0" />	
		<hiddenfield name = "bcldb_levels"  value = "0" />
		<hiddenfield name = "bonus"  value = "0" />
		<hiddenfield name = "is_save"  value = "0" />
		<hiddenfield name = "is_bcldb"  value = "0" />		
		<hiddenfield name = "is_float"  value = "0" />
		<hiddenfield name = "level"  value = "0" />
		<hiddenfield name = "province_id"  value = "0" />
		
		<hiddenfield name = "sales_commission_level_id"  value = "0" />
	
		<hiddenfield name = "lkup_commission_sales_sum_type_id"  value = "0" />
	
		<hiddenfield name = "user_id"  value = "0" />
		
		<hiddenfield name = "lkup_sales_commission_type_id"  value = "1" />
		

      <!--section 1  REGUALR STORE -->
  
		<editfield name="min_intl_cases"   value="100" label="International wine cases"    size="7" length="25" required="T" tabindex="1"  autotrim="T" mask="float">
			<listener type="JS" event="onblur" action="setCases(this,0)"/>
		</editfield>
		
		<editfield name="min_canadian_cases"  value="80" label="Canadian wine cases"    size="7" length="25" required="T" tabindex="2"  autotrim="T" mask="float">
			<listener type="JS" event="onblur" action="setCases(this,1)"/>
		</editfield>
		
		<editfield name="bonus_d" label="Bonus for minimum target" tabindex="3" size="7" length="25" >
			<listener type="JS" event="onblur" action="setPrice(this,4)"/>
			<listener type="JS" event="onKeyPress" action="return chkFLOAT4B(this,event);"/>
		</editfield>
		
		<editfield name="min_cases1"   label="Cases"    size="10" length="25"  tabindex="4"  autotrim="T" mask="float"/>	
		
		<editfield name="max_cases1"   label="Cases"    size="10" length="25"  tabindex="5"  autotrim="T" mask="float">
			<listener type="JS" event="onblur" action="setCases(this,2)"/>
		</editfield>
		
		<editfield name="comm1"     label="Commission %"    size="13" length="25"  tabindex="6" autotrim="T" mask="float">
			<listener type="JS" event="onblur" action="checkOverComm(this,1)"/>
		</editfield>
		
		<editfield name="min_cases2"   label="Cases"    size="10" length="25"  tabindex="7"  autotrim="T" mask="float"/>
		<editfield name="max_cases2"   label="Cases"    size="10" length="25"  tabindex="8"  autotrim="T" mask="float">
			<listener type="JS" event="onblur" action="setCases(this,3)"/>
		</editfield>
		
		<editfield name="comm2"     label="Commission %"    size="13" length="25" tabindex="9" autotrim="T" mask="float">
			<listener type="JS" event="onblur" action="checkOverComm(this,2)"/>
		</editfield>
		
		<editfield name="min_cases3"   label="Cases"   size="10" length="25"  tabindex="10"  autotrim="T" mask="float"/>
		
		<editfield name="max_cases3"   label="Cases"     size="10" length="25"  tabindex="11"  autotrim="T" mask="float">
			<listener type="JS" event="onblur" action="setCases(this,4)"/>
		</editfield>
		
		<editfield name="comm3"     label="Commission %"    size="13" length="25"  tabindex="12" autotrim="T" mask="float">
			<listener type="JS" event="onblur" action="checkOverComm(this,3)"/>
		</editfield>
		
		
		<editfield name="min_cases4"   label="Cases"    size="10" length="25"  tabindex="13"  autotrim="T" mask="float"/>
		
		<editfield name="max_cases4"   label="Cases"    size="10" length="25"  tabindex="14"  autotrim="T" mask="float">
			<listener type="JS" event="onblur" action="setCases(this,5)"/>
		</editfield>
		
		<editfield name="comm4"     label="Commission %"     size="13" length="25"  tabindex="15" autotrim="T" mask="float">
			<listener type="JS" event="onblur" action="checkOverComm(this,4)"/>
		</editfield>
		
		<editfield name="min_cases5"   label="Cases"    size="10" length="25"  tabindex="16"  autotrim="T" mask="float"/>
		
		<editfield name="max_cases5"   label="Cases"     size="10" length="25"  tabindex="17"  autotrim="T" mask="float">
			<listener type="JS" event="onblur" action="setCases(this,6)"/>
		</editfield>
		
		<editfield name="comm5"     label="Commission %"    size="13" length="25"  tabindex="18" autotrim="T" mask="float">
			<listener type="JS" event="onblur" action="checkOverComm(this,5)"/>
		</editfield>


            <!--buttons note -->
		<buttons>
			<button name="btnBack" type="BUTTON"  value="Back" tabindex="29">
		        <listener type="JS" event="onClick" action="openPage(0)"/>
		    </button>
		    
			<button name="btnAddNext" type="BUTTON"  value="Next" tabindex="29" />
		    
			<button name="btnAdd" type="BUTTON"  value="OK" tabindex="29"/>
			
     		<button name="btnCancel" id="btnCancel" type="BUTTON" value="Cancel" tabindex="30"/>
		</buttons>


	</section>

</form>



	<!-- Form60 : template used in addestate.php -->
