<?xml version="1.0" encoding="iso-8859-1"?>
<!DOCTYPE form SYSTEM "..\..\docs\dtd\php2go_forms.dtd">
<form >
    
	<section name="" id="f60overduereports" required_flag="T" required_color="#FF0000" required_char="*">
                <hiddenfield name="estate" value="0"/>
                <hiddenfield name="isWine" value="0"/>
                <hiddenfield name="isQtr" value="0"/>
                <hiddenfield name="isStart" value="0"/>
                
            		
               
              

        <lookupfield name="estate_id"  label="Estate" tabindex="1" nofirst="T" multiple="F" size="1" width="195" >
			<datasource>
				<keyfield>estate_id</keyfield>
                                <displayfield>estate_name</displayfield>
                                <clause>deleted=0 and billing_address_country like '%Canada%' and deleted=0</clause>
                                <orderby>estate_name</orderby>
				<lookuptable>estates</lookuptable>
			</datasource>
		</lookupfield>
		
		<lookupfield name="lkup_store_type_id"  label="Store type" tabindex="1" nofirst="F" multiple="F" size="1" width="130">
			<datasource>
				<keyfield>lkup_store_type_id</keyfield>
                                <displayfield>license_name</displayfield>
                                <clause>lkup_store_type_id !=8 and lkup_store_type_id!=4 and lkup_store_type_id!=6</clause>
                                <orderby>caption</orderby>
				<lookuptable>lkup_store_types</lookuptable>
			</datasource>
		</lookupfield>
		
		<lookupfield name="user_id"  label="Assigned to" tabindex="1" nofirst="F" multiple="F" size="1" width="130">
			<datasource>
				<keyfield>user_id</keyfield>
                    <displayfield>concat(first_name,' ', last_name)</displayfield>
                    <clause>deleted=0 and user_level_id!=5 and user_level_id!=6 and user_id!=26 and (user_id =7 or user_id=6 or user_id =51 or user_id = 22 or user_id =43 )and (province_id=1) </clause>
                                <orderby>first_name</orderby>
				<lookuptable>users</lookuptable>
			</datasource >
		</lookupfield>
		
	<combofield name="overdue_type" label="Overdue days" nofirst="T" multiple="F" size="1" default="3" width="195" disabled="F" tabindex="4">
	        <option value="0" caption=" All "/>
	        <option value="1" caption=" 31 to 60 days"/>
   	        <option value="2" caption=" 60 to 90 days"/>
   	        <option value="3" caption=" Over 90 days"/>

      </combofield>
	

	</section>

</form>
<!-- -->
